{
  "id": "NOUVEAU",
  "titre": "Nouveau scénario",
  "type": "couple",
  "lui": "Lucas",
  "dates": {
    "debut": "2025-09-01",
    "fin": "2026-10-12",
    "lune_de_miel_fin": "2025-12-01",
    "tournant": "2026-06-01",
    "record": "2026-02-14"
  },
  "rythme": {
    "elle_lance": {
      "avant": 0.75,
      "apres": 0.85
    },
    "lui_reponse_min": {
      "lune_de_miel": 20,
      "avant": 55,
      "apres": 85,
      "nuit": 12,
      "record": 3
    },
    "elle_reponse_s": 100,
    "dialogues_par_jour": {
      "lune_de_miel": [
        4,
        6
      ],
      "avant": [
        2,
        4
      ],
      "apres": [
        1,
        3
      ],
      "record": 55
    }
  },
  "mot_a_vous": {
    "mot": "croissant",
    "debut": "2025-10-01",
    "proba_par_jour": 0.4,
    "dialogues": [
      [
        [
          "Y",
          "j'ai ramené des croissants"
        ],
        [
          "L",
          "encore des croissants mdr"
        ]
      ],
      [
        [
          "L",
          "croissant ce matin ?"
        ],
        [
          "Y",
          "toujours"
        ]
      ]
    ]
  },
  "vocaux": {
    "L": 0.012,
    "Y": 0.03,
    "Y_nuit": 0.12
  },
  "munitions": [
    [
      [
        "2025-09-01 14:05",
        "Y",
        "c'était cool hier soir"
      ],
      [
        "2025-09-01 14:06",
        "L",
        "trop 😊"
      ]
    ]
  ],
  "derniere_semaine": [],
  "ecran_choc": [
    [
      "2026-10-12 21:47:12",
      "L",
      "premier message de l'écran choc"
    ],
    [
      "2026-10-12 22:31:40",
      "Y",
      "sa réponse"
    ],
    [
      "2026-10-12 22:33:05",
      "L",
      "la chute"
    ]
  ]
}